id,text,label
1052,tâm tà mỏ_ác muôn_đời nát folded hands,0
7270,phải công_nhận tường san rất đẹp ! kế_tiếp đại_diện belarus,0
425,đã béo như con lợn xề rồi còn ăn lắm uống lắm nữa chứ,2
7090,một hoa_hậu xinh nhất mọi thời_đại !,0
6573,tuyên huyên mập ốm mình vẫn ủng_hộ cô !,0
1163,móng tay dài đẹp ghia tao cần kiềm cắt móng relieved face,1
4831,kinh_khủng vãi iồn con mụ trà_bông,2
1370,bả dịu bả xinh,0
6708,minh 1m7 nặng 53 kilogram ma chồng bảo mập huhu,0
1796,vậy đầu trâu mặt ngựa có nghĩa_đen luôn,0
1251,u40 cổ cỡ,0
527,eo 56 sao nay nhìn thẳg đuỗn vậy nhỉ có vẻ eo to rôi thi fai,0
514,chết ai khiên nổi,1
4176,cô gái tiền_sử,0
3195,chị đẹp phát sáng luôn face with open mouth,0
3057,tao tặng 2 bạn voucher bẻ xương cột_sống,0
6449,định_nghĩa_vẻ đẹp đích_thực bạn có tăng chục kí gầy vẫn luôn mỹ_nhân đẹp bất_chấp,0
4520,quỳ rồi nè lẹ ướt nhẹp hết rồi,0
2076,bà ngày cảng trẻ_hóa_á trời < 3,0
1880,bộ bà mắc so_sánh nhỉ người vẻ chứ hề hước thật face with bags under eyes,0
6528,sao nhìn cô hiền hồ lại hao_hao nhỉ ?,0
5912,hốc cho lắm rồi đi tập gym,0
3234,người chấm chấm đen cho xấu_vậy chứ đẹp lắm red heart red heart,0
4337,đừng nami thấy video,0
4317,hữu duyên bl face with tears of joy,0
1945,coi bả riết tui cũng tự hỏi sao bả chưa có bồ chứ tui con_trai tui theo_đuổi rồi á,0
473,ủa trai giả gái,0
6571,quá đúng tuyên huyên đóng phim quá coi vui nhất phim hài cô đóng,0
2463,kiểm_tra thật kỹ tất_cả mặt_hàng nhân ơi,0
6241,nhìn như đôi đũa lệch,1
5878,tập được 2 ngày thấy đăng hốc nhìu hơn,1
3103,ừ cao_thủ không bằng tranh_thủ dù_sao mình không ngại đã có người ngại hộ rui,0
6550,đẹp khổ cần gì đẹp đơn_thuần chồng không chê gia_đình hạnh_phúc tốt nhất,0
233,có hút_chích gì không vậy,0
5985,nhiều nghệ_sĩ da_màu cũng đẹp thật riêng trường_hợp,1
2366,coi mong ẻm muốn đánh quá red heart,0
4741,vốn_dĩ nhan_sắc như vậy giờ face with hand over mouth,0
6481,vẫn kém sắc hơn kim_thanh kiều_trinh,0
2931,giao_diện dễ_thương quá k,0
1849,bé giống cô diễn_viên người nhật á siêu_mẫu lùn nhất thế_giới phải,1
5004,1 biểu_tượng nhan_sắc việt . . không chỉ cánh mày râu còn cả phụ_nữ . . tiếc cho em . . biết sở_thích người,0
4697,thoi thà như ngày_xưa che mặt không có drama,1
3401,bảo_tàng 798 như địa_ngục trần_gian xem rợn người,0
1826,trả hết quyển từ_điển khen_ngợi cho chụy,0
3896,anh có hàm_răng đều đẹp quá,0
6408,nhan_sắc quá bình_thường còn mức_độ hấp_dẫn lại càng kém có_lẽ gu thẩm_mỹ mình thiên về độ hiền chẵng ?,2
657,nét đẹp chuẩn hoa_hậu,0
6581,phải nói quá đẹp,0
3660,bên trung con_gái bị gì cứ ẹo ẹo dẹo dẹo rồi lắc lắc_lư nhún nhún nhìn ghê vãi hết cả lon,0
3890,nam9 chưa sửa thế chả phải đẹp không tự_dưng đi sửa mặt nhìn,1
6814,mình nghỉ hg mập 1 tí mới đẹp đùi hơi ốm quá quan_trọng tập_luyện giữ vòng eo không bị,0
1351,cưng méo chịu được,0
611,đẹp quá mê quá em luna ơi,0
3659,cú có gai có râu face with tears of joy face with tears of joy face with tears of joy,2
7236,Việt_Nam chắc cần chọn ứng_viên có khuôn_mặt dài chứ thấy tròn bầu đi thi hình_như khó được giải,0
3314,mặt không đẹp được dáng chuẩn ngực múo face with open mouth,0
2067,giống gái hàn nhé,0
6567,tuyên huyên quá dễ_thương nhất môi cười diễn không chê được,0
7310,người tiền_nhiệm đẹp hơn dù_sao cũng hơn mình trăm lần,0
5664,ngọc trinh đẹp tốp 1 việt nam không ai đọ được nhan_sắc tự_nhiên không dao kéo giờ hoa_hậu bé gái phẫu_thuật hết mặt na_ná giống nhau hết riêng ngọc trinh_vẻ đẹp tự_nhiên red heart red heart,0
4992,em đẹp_trai lắm,0
4965,tiếc cho phương trinh đẹp thế_mà giờ vậy thấy tiec,0
960,chân chồng nhỏ quá,0
4342,quỳ rồi sao nữa,0
189,néch hơi thâm có triển_vọng,2
3785,trung quốc nôi filter con_gái có_thể không biết trang_điểm chắc_chắn phải biết dùng filter đời không đẹp cũng được mạng phải tuyệt sắc giai nhân còn việt nam không dùng nhiều filter chỉnh_sửa lắm chủ_yếu làm mịn da dưỡng khuyết_điểm da thôi việt nam chủ_yếu chú_trọng trang_điểm trang_điểm nhẹ_nhàng tinh_tế cũng phải thật tự_nhiên trang_điểm không trang_điểm luôn vì_vậy hồng tỉ đời rõ_ràng không đẹp vậy_mà vẫn lừa tình được đóng chàng trai còn việt nam gái đẹp đâu_đâu cũng thấy thế_mà vẫn có một đống người ế chỏng ế chơ,0
5079,đẹp quá xuất_sắc luôn em ơi,0
6262,anh yêu ơi em đi làm về rồi nè,0
477,nói thật chị tăng cân siu đẹp lun ý,0
4393,phần đăng lại bé đi ạ,0
672,urg mê chân dài quá hand with index finger and thumb crossed light skin tone heart hands light skin tone cặp kiếm quá đỉnh,0
727,tại_sao trai đẹp lại đi làm phục_vụ smiling face with hearts smiling face with hearts smiling face with hearts,0
6222,bạn chưa béo chưa cảm_nhận được sự nguy_hiểm việc thừa_mỡ thừa không làm_ơn kiểm_soát gì mình đưa dạ_dày,0
2404,trúng bà dì si tai không ổn,0
2123,cố bạn ơi red heart,0
4252,ỏo,0
269,ủa nhìn tưởng cô mỹ duyên thời trẻ không á,0
5604,xứng_đáng được gọi tình đầu,0
4015,xin ít nước pha mỳ,0
825,đẹp quá nhiều chả biết nói_gì,0
1041,độn dữ_vậy trời,1
161,chọn nam vương xấu nhất nam vương xấu,2
1918,chị ăn cơm chưa,0
6823,mình thích bạn y chí nghị_lực chúc bạn thành_công,0
5263,vừa đẹp_trai vừa xinh gái kiểu gì á =,0
5439,sời tinh_thí,0
3325,sao tui thấy không ai đẹp_trai hết_vậy,1
5477,ui ăn gì xinh quá zị bà,0
5796,sít rịt lè khe kìa,0
5287,con bot mạnh nhất việt_nam,0
163,trời ơi mắt bị lác,2
497,thần_tượng em chỉ không đẹp_trai thôi còn lại ok hết,0
2005,chúc bé thuỵ luôn cưng_vậy nha yêu yêu,0
547,chán không muốn nói,0
6979,vẫn chưa đủ tầm sánh vợ mình hi_vọng cô đọc được,0
5759,ai còn thích sang nữa không cười,0
2291,không lấy đâu được,0
2738,1 sao như toàn lại ngon tối ngủ ôm 4 bình sữa ngủ phê,0
5050,quốc_tế tao vẫn vẫn lụy đầm dạ_hội vàng trời ơi đẹp như nữ_thần sải chân bả tới đâu tỏa sáng tới smiling face with hearts smiling face with hearts smiling face with hearts,0
5216,quá đẹp mãi yêu giờ ' hen nie,0
1711,đùi nó bằng thân tao luôn,1
1302,nhuộm riết tóc nó cháy hết cho chừa,0
6916,buồn quá,0
1465,trán dồ bù thông_minh,2
3722,chị ngực bự mặc bộ gợi_cảm_vãi ò,0
1861,đúng nhìn bé làm chị xao_xuyến muốn ngắm mãi thôi chúc em luôn xinh_đẹp giữ được phog độ nhé,0
4851,djt me tởm vãi lon nhìn dơ dơ sao loudly crying face,0
2386,su ơi tóc sẽ dài nhanh con thỉnh_thoảng thay_đổi kiểu tóc cũng nhân quá tuyêt vời chăm_lo cho mẹ chị gái giờ cả cháu nữa ngưỡng_mộ em rất nhiều,0
2348,tiểu_bối ơi con đáng yêu lắm con bảo mẹ cho con videos nhiều con kiểm thêm viu con kiểm tiền về cho ba mẹ nhé gia_đình con hạnh_phúc lắm mẹ nhân con làm_ăn có tâm nhé đừng làm gì như kênh nổi_tiếng khác lừa_gạt cộng_đồng rồi pháp_luật sờ khổ phiền_phức lắm thương tiểu_bối con hãy ngoan khôn_lớn tình_yêu_thương ba mẹ mọi người nhé,0
7108,nhìn nụ cười khuôn_mặt giống thùy_tiên nhỉ,0
1627,anh tấn_công tui bằng nhan_sắc smiling face with heart eyes tui mách sêpa tui,0
6909,ngay từ đầu họ tới bên nhau đã có 1 khoảng_cách rất xa không gần_gũi vững_chắc như cặp kim tea hee bi rain không bất_ngờ quá gia_đình người phụ_nữ có tài hơn,0
6130,tình mẫu_tử thiêng_liêng bất_diệt,0
4707,tẩy_trang biết liền smiling face with smiling eyes,1
2930,ôi nụ cười cô khiến tôi điên_đảo,0
393,linh càng ngày_càng xinh em,0
5613,cười xinh smiling face with hearts smiling face with hearts,0
5444,xinh gái,0
1519,phóng lợn chứ kiếm nhật gì,0
5463,mồm tươi_rói,0
4424,đúng tên anh yeu,0
1567,biết lý_do đỗ thị hà biểu_diễn bộ váy rồi khoe trọn đôi chân đẹp mien man smiling face with hearts,0
198,em bé hồng hài nhi đẹp_trai nhất nhà,0
6946,khó chưa bao_giờ quốc_gia thi hoa_hậu có người đoạt vương_miện năm trước năm sau có thí_sinh sâu được cả chưa nói tới cơ_hội vương_miện duy được giải phụ trang_phục đã quá tuyệt_vời rồi vote lại còn mất tiền nữa lại càng khó lại hoàn_cảnh nước mình đang bão lũ triền_miên hiếm có ai bỏ tiền đi bình_chọn hoa_hậu được,0
2,ủa bụng nhỏ như vậy rồi nội tạng đâu,1
289,còn gái túi 3tủi xem bảo xinh_đẹp quá face with tears of joy,0
196,giống ông làm nhôm kính điện nước thật,0
28,con bé mâp chứ vẫn xinh,0
273,quá nét em ơi,0
4436,phần đăng lại tao,0
2457,mi cây,0
5311,ảnh đầu 1 thời bùng_nổ loudly crying face,0
624,2 con yêu nhền nhện đẹp qué,0
3386,ai đánh khối mũi cô diễn_viên như khối mũi đầu tượng dân học vẽ vẽ vậy trời,0
2831,chuẩn luôn như lột_xác lun chị yêu face with tears of joy red heart red heart red heart,0
6334,nhìn chị trẻ hơn tuổi rất rất nhiều luôn mái_tóc đẹp thướt_tha đậm bản_sắc con_gái việt,0
3308,nhìn vãi cả pịa face with tears of joy,0
7397,dung tham hoa thoi trang có nay vua lun vua map mac quan ao thay ghom !,2
2172,nhân nói hết cả phần chồng nói không biết mệt mình nghe còn thấy mệt nữa người nói,0
4797,eo nhìn quả thân_hình tao cảm_thấy khó thở uất_hận người sao sao á,1
4374,quý không cần bù ư,0
3920,lông dú bựa vãi,2
2311,ăn_vậy còn dư ai dám ăn,0
4787,xấu + tởm loudly crying face folded hands nó sợ bị chửi không nói ngứa_mồm smiling face,2
5479,dễ_thương qué,0
2730,đại_béo nhìn thèm quá face with tears of joy face with tears of joy giảm cân chứ làm thử_thách thấy ngta ăn thèm quá mỡ nó nẩy face with tears of joy,2
850,mỏm hơi to hee,2
4848,đang ăn cơm lướt chúng bỏ luôn bữa ăn tắt máy suy_nghĩ,0
194,quả nhìn như cá_basa_vậy,2
5267,ui anh xink trai vậy 0 tự_nhiên tiếp năng_lượng ghia face with hand over mouth,0
5621,xinhqa green heart có dịp mời mng ghé nhiên thử trà sữa cốm best seller chúng_mình đi ạaa green heart green heart green heart,0
7110,mình đang thắc_mắc cũng người việt_nam cũng đi thi sắc_đẹp phụ_nữ việt_nam khó đạt thứ hạng cao đàn_ông việt_nam thường đạt thứ hạng cao,0
2833,sao chj đáng yêu_dạ,0
4051,ổng không chịu kìa face with tears of joy,0
1003,bạn ý bị sưng à,0
147,ca nặng,1
5631,dth,0
1696,dế thương ghê muốn thương_yêu em thật lòng quá,0
7167,không đẹp bằng hoa_hậu việt nam !,0
4952,thấy tiếc cho nhan_sắc quá flushed face,0
299,nhìn người_ta thay_đổi ham còn tao đổi_thay thành tinh,0
2065,trời ơi tui mất góc tàn_ác thiệt chớ face with tears of joy face with tears of joy face with tears of joy,0
2392,tóc mới đẹp mè nhìn nữ_tính hơn bé su có nụ cười giống mẹ rất có duyên,0
301,thay_đổi cũng cần có gì mới được hả anh_em ?,0
3622,thái_tử méo gì ích_kỷ xấu_xa hèn_hạ hết phần thiên_hạ_vậy,0
1975,chị thuỵ tỉnh thế em muốn gặp chị ghê em asaka saitama crying face,0
2847,xinh nha tông makeup hợp khuôn_mặt màu nha face with tears of joy,0
5084,đôi chân chời ơi mê quá cíu tui,0
6457,phim truyền_hình dần có chỗ_đứng lòng tôi nhiều khán_giả phản_ánh đúng chân_thực đời_thường cuộc_sống mưu_sinh nhiều bạn so_sánh phim việt phim nước_ngoài diễn_viên thế thế quả_thực so_sánh nói gì quyền người chẳng phải phim việt đang tốt dần đấy thôi tôi chỉ có phim việt_nam diễn_viên việt nam mới lột_tả hết được cuộc_sống thực_tại việt_nam,0
3181,thứ nhất tao thấy cổ xinh thứ hai tao cũng thấy ông xinh,0
4643,lần đầu không mê trai 6 múi,0
261,ôi trời ơi face with tears of joy,0
6597,thích từ bé phạm băng băng giờ chị cũng có tuổi vẫn thích,0
4989,ui ! tui thấy sợ luôn ! tiếc cho 1 nhan_sắc,0
5546,xinh vãi chời,0
5681,thực_sự không nhìn nổi !,2
6586,tên_tuổi đang nổi đình_đám lại vướng scandal trốn_thuế mất hết sự_nghiệp,0
944,ấn_tượng mê_vẻ đẹp mỹ_nhân tân cương,0
2593,nga sumo mới ăn tục còn nhân ăn bình_thường có gì đâu nói nặng_vậy,0
2432,còn chương_trình khuyến_mãi nồi không con,0
458,2 quá mãi_mãi đỉnh,0
791,nữ chính bị dán mặt cho xấu chứ cổ đẹp,0
2585,nhìn em thuận dễ_thương quá chúc em luôn nhiều sức_khỏe nhé,0
6086,ngu mặt vuông mũi phù_thuỷ,2
3368,mỹ_nhân sẹt xy red heart red heart red heart red heart,0
2437,tây ninh có sip không con,0
106,ăn mẹ lun túi gà kfc,1
2542,nữa ha chị nhan em không biết bên chi ơi sau chị không ban kênh chi,0
4921,có ai bị hội_chứng sợ angela phương trinh giống tao không bây,1
2258,đã mua ăn mỳ sợi mỳ biết toàn cay ngọt không đậm vị hợp dân nam hơn,0
3428,thằng hề xã_hội,0
7230,mừng cho tường san bao_nhiêu tiếc_nuối cho em cười quốc_tế Việt_Nam 2019 nay lại kỳ_vọng em bấy_nhiêu hy_vọng vinh_quang sẽ thuộc về em_em xứng_đáng cười đẹp nhất thế_giới thời_điểm,0
46,cô người có sức hút hút mọi vật_thể,1
2688,vĩ tóc nhìn hiền dễ_thương giữ nha,0
6068,2 mắt cách xa nhau nhìn rất lạ,0
6878,vấn_đề cô không hề đẹp như ảnh chưa photoshop chụp cam thường cô như hầu_hết phụ_nữ 40 khác 40 khoẻ cân_đối đủ dinh_dưỡng quan_trọng hơn hà_khắc bản_thân,1
4828,như con tật,2
2870,dùng sức_mạnh lông nách_bóc được mọi thứ,1
1126,khoe vậy tưởng tụi tui mê ư ?,0
6640,nhiều phát_tướng cũng dễ_thương,0
4029,dạ em chào chị thy mọi_người ạ em có làm video mukbang mọi_người có_thể coi góp í cho em được không ạ em cảm_ơn mọi_người nhiều ạ em xin_lỗi chị mọi_người đã làm_phiền ạ pleading face,0
1286,mang giày phù_hợp có_thể hack dáng trông cao hơn,0
4706,được nhảy đẹp thôi chứ tao thấy gì cũng bình_thường,0
6216,tôi chỉ thấy vẻ suy_yếu sức_khỏe thần_kinh bạc_nhược anh_chàng,0
1665,xin vía eo thonn,0
323,nt đẹp không dao_kéo,0
5901,tý má lên_cơn đói nuốt cả phòng gym không ai chạy được đâuu,1
3728,bà đầu chân đẹp trắng vãi,0
3923,banh cot tinh phai trang treo,0
1287,chị sài gì da trắng dữ_vậy ?,1
1895,nhìn bé có xinh như khuôn_mặt không thiện_cảm lắm,0
6356,app gánh cồng lưng luôn ',1
4024,tour nhiu em ?,0
5562,chỉ muốn khen bà quá tuỵt vời hoi,0
7210,tường san có một vẻ đẹp rất nữ_tính,0
1393,nhìn lưng biết mỹ_nhân,0
5768,mắt lè khe vẫn hót,1
4156,có duyên quá grimacing face,0
2921,chế chế troang điểm nuột ghê_ghớm,0
2159,cô muốn mua 5 set bên con có giảm_giá thêm không con,0
6283,kỳ duyên có nét đẹp riêng_biệt không biết giữ_gìn tiếc cho nhan_sắc tuổi thanh_xuân rực_rỡ cháu,0
4058,thưa toà cô định quyến_rũ tao,0
3688,mặt ảnh gian mắc ghét ghê không có giỡn nha,0
4057,không ai bằng anh tú có cô vợ 10 / 10,0
4838,tởm vãi cả cứt đg ăn cơm ói sạch loudly crying face loudly crying face loudly crying face,0
7225,thường cuộc thi khác phần thi áo_tắm sẽ diện trang_phục giống nhau cuộc thi lại diện áo_tắm kiểu_cách tự_do nhìn hơi lộn_xộn không được đẹp cho lắm,0
4071,hộ video mới ạ red heart,0
2551,vay con ban o đau chu o Việt_Nam rôi lam sao mua chu muông mi nhu vay cho an toan thi lam sao,0
3049,mặt cô gái quá xấu xúi đi cua đại_gia nghe tức_cười . . bỏ một_vài tỉ đi tút lại nhan_sắc họa may còn tùy tay_nghề bác sỉ,2
4967,đẹp rồi đẹp như thị nở rolling on the floor laughing rolling on the floor laughing,1
476,coi_bộ kí mặt bé tròn,0
1837,thôi kệ chỉ đẹp mình bỏ_qua,0
1572,chân thẳng đẹp quá thôi beating heart beating heart,0
5387,màu son bà hãng bào vậy nhìn keo quá,0
7353,camera 360 độ hân_hạnh tài_trợ chương_trình,0
2862,yêu_cầu chị làm mũi nha không_chừng thành hot_girl luôn chứ không phải hot tiktoker đâu grinning face with sweat grinning face with sweat,0
564,bao_nhiêu người khiêng không đếm được không đếm được,1
2268,giấu đi có giàu đừng khoe hòi nữa vô khia ngồi đấy em đừng lấy danh_hiệu nổi_tiếng chị thấy nhiều người bị rồi em bé em con nhỏ lắm nhé em grinning face with sweat,0
4273,xinh vãi em yêu chị,0
2073,mùa hè năm 33t tui nằm coi mùa hè nhỏ 25 tuổi rồi tủm_tỉm cười,0
7368,cơ_thể gương_mặt rất giống bạn gái cũ tôi,0
531,2 lưng,1
3388,thôi đừng giả_tạo,0
5686,công_nhận đẹp thật,0
3252,vậy giống dữ chưa con chị giống ma,2
219,móa sao tao thấy 3 thằng đực_rựa_vậy,0
30,kì_vậy trời,0
3692,nhìn mõm ông thây nó kinh vãi,2
3544,động chứa gái mua_bán người công_khai vậy sao ?,0
3885,nam 9 non_choẹt gầy quá nhìn trẻ hơn nữ 9 nhìu quá,2
1693,tôi thấy có tiềm_năng việc đầu_tư cô cũng như đầu_tư bitcoin 2010 moai,0
4354,mình luôn thắc_mắc tập như_vậy chế_độ ăn_uống như_thế_nào nhể smiling face with hearts,0
6580,ờ công_nhận cũng đẹp gần bằng mình,1
1710,tay to hơn cae gymer,0
7075,khó tin ngỡ_ngàng bật ngửa pa out top 15,0
5275,mặc_kệ top bot đẹp_trai được,0
4653,không rung_động nổi,1
1046,cô đẹp thật đẹp luôn,0
513,giảm cân đi em học trọng nhân đấy em_trai,0
3677,ông tức_giận nhần mặt ngu như thằng nghiện ý,0
3707,n 9 đẹp ngọt_ngào quá,0
7054,người tây sớm nở nhanh già thôi,1
2578,mở xưởng mỳ cắm cả chồng việt nam luôn mất luôn gốc nhật luôn mưu_mô thật chia_rẽ anh_em ruột ngta,0
498,chính ma_nhân bư bảy viện ngọc rồng đời thực sao kakaka,1
3275,mắt bà bị buồn quá á,0
6985,cô đóng vai nàng bạch tuyết tuyệt quá bạch tuyết phải trắng_trẻo mới đúng bạch_tuyết,0
3158,thằng trùm cuối thằng được make in jà bỏn,0
6891,tan hết cả cõi_lòng,0
4557,quỳ làm_gì em banh chân rồi nè,0
557,nhìn hết ngày_một khác trời đẹp,0
2297,nước súp hơi ngọt nha ạ sợi mì ngon cay tí nữa càng ngon,0
160,thí_sinh lé giám_khảo mù,2
484,hợp nhãn fan quốc_tế chắc gì đã hợp mắt ban giám_khảo ? ? chúng_mày cứ seeding cho quá nhìn đơ mặt men vô top tao làm con chúng_mày luôn,0
6725,không tinh_bột vẫn có nửa bát cơm bánh_bao chay khoai_lang ? ? pp ăn_kiêng không tinh_bột low carb yêu_cầu 20gr carbonhydrate / ngày mình ăn_kiêng lc khá tuyệt_đối + chạy 3km / ngày cũng chỉ giảm được 12 kilogram / 2 tháng,0
2744,không cho mặt bảo hình nha nhìn không bao_giờ thấy có thiện_cảm_chút mặt nhìn đã bậm_trợn còn tattoo chữ chả_bù cho hào milk,0
1094,thấy gớm vcl,2
5260,bạch nguyệt quang loudly crying face,0
1377,sao đẹp không góc chết dị bà smiling face with tear,0
6365,mẹ bỉm xinh 2 bố con nhìn trộm_vía quá,0
7325,việt nam đẹp nữ_tính nhất,0
6467,bây_giờ đa_số diễn_viên đều bọc răng sứ trắng sáng hết đóng vai nghèo_khổ nhìn không hợp,0
5792,tao sợ bị chích điện chứ không tao đã sang cam bế anh về rồi nam thần mắt lè khe luôn,1
208,đẹp_trai,0
4973,tiếc cho nét đẹp trời ban,0
6204,giọng không thay_đổi đẹp_trai !,0
1688,đầu tao thấy anh đẹp_trai bén_ngót nhìn mặt khá lạnh_lùng tao đã tưởng ảnh sẽ đẹp_trai trầm tánh ai dè ảnh còn hoang_dã hơn 4 anh_em pensive face,0
5182,u_mê hen nhất smiling face with hearts smiling face with hearts smiling face with hearts smiling face with hearts,0
1166,người đẹp ngủ cũng đẹp nữa,0
6863,jessica huan lúi koo sao giờ vẫn không thành đôi nhỉ ?,0
6652,ai giảm cân = hình_thức tự_nhiên tôi nễ phục ý_chí họ ! chúc_mừng em !,0
6177,nhìn em có da có thịt rất dễ_thương,0
6299,thực_tế nha tóc da màu không quan_trọng bằng nhìn khỏe_khoắn người lớn_tuổi sợi tóc mỏng xơ dễ thấy xù_xì quăn_queo ráng dưỡng ẩm dầu dừa dầu dưỡng phù_hợp giữ nếp tóc đúng kiểu cắt đều đẹp à,0
1518,kiếm nhật nó cong cong đúng rồi còn gì ỷ thiên mới thẳng,1
4913,tưởng bầu không bận vậy cũng dám bận,0
5619,hot quá chị yêu,0
6082,chưa thấy ai xấu như con_mẹ,2
5510,đeo khẩu_trang không trúng_gió đấy em winking face with tongue,0
1866,body khoẻ_khoắn cơ đét luôn toàn cơ cơ,0
7247,cố em,0
1352,bỏ son_phấn tôi mới tin grinning face with sweat grinning face with sweat,1
5606,có_thể gọi bạch nguyệt quang lun bà ơi,0
5044,đợt mình không xem eo đẹp từ nước đẹp smiling face with tear tuyệt_vời áaa,0
5852,im_lặng tập thôi bị chửi rồi còn up bị chử x2 nữa có thay_đổi rồi up may_ra mới o bị chỉ_trích,0
6119,nhìn mặt gớm PROFANITY_STRONG,2
7257,maria perviy đại_diện belarus đẹp như tranh_vậy,0
5411,nhủ mắt đẹp quá ạ,0
3027,con_mẹ biết kịch_bản chắc no không ve_chúa sao ý,0
2393,cưới vợ cho cháu nó vừa face with tears of joy,0
7418,1 57m lùn gì chỉ hơi thấp đúng hơn,0
3340,trùm cuối đúng kiểu mỹ_nhân thời đường luôn,0
3653,công_nhận chị xinh thật cả ngoại_hình lẫn mặt đều xinh có phần hơi điên_loạn kiểu xinh,0
3451,cơ_bắp ngon quá face with open mouth face with open mouth,0
2452,chị ơi em muon mua combo 10g mi con được tặng nồi không chi,0
751,chim nhỏ vãi,1
2888,dm dan ong hu ?,0
75,10 tế_bào ung_thư 1 cm3,2
5065,body đỉnh chop catwalks không con gì nói hoa_hậu phải mềm mượt nthe chứ,0
3863,ngoại_hình đẹp không không qtrong qtrong bạn phải biết bẻ cong không_gian penguin,1
5620,xinh yêu thế nàng oi,0
5645,bà cười tôi mở_mắt hông nổi òi beaming face with smiling eyes,0
6671,em mong chị sẽ tham_gia một dự_án phim thời_gian tới,0
5403,xinh PROFANITY_STRONG,0
4664,chắc mới sẽ gầy nhau xong tiện_thể đu trend luôn đúng hăm,0
4381,bá bá thả gu,0
7383,năm cũng thấy venezuela đăng_quang đẹp cũng đẹp n cô cũng na_ná nhau,0
719,chân còn hơn sào đồ nhà tao nữa,1
4279,set đồ xinh two hearts bln jce spc,0
4910,nghe nổi da lợn smiling face with hearts smiling face with hearts smiling face with hearts,0
590,xài app béo tay bé tí,1
2775,xấu_xí lại bày trò để_ý,2
6050,2 bố con hát quá,0
3366,tên bài hát thính bay lung_tung,0
3215,trùm cuối đẹp_trai xin hãy bình_thường ạ =,0
3230,góc nghiêng thần_thánh góc nghiêng trời_đánh face with tears of joy face with tears of joy face with tears of joy,1
4076,sướng nhất bé tú rồi còn gì,0
202,người đẹp hoang_dã,0
6412,mình thích giọng hát liên_quan về nhan_sắc có đắp hàng_hiệu đầy người cũng không giải_quyết được gì trời không cho ai tất_cả,1
7316,năm cho 1 nước đăng_quang tốt rồi bình_đẳng giới sẽ được tuyên_truyền ngày_càng rộng_rãi năm sau ai ? miss phillipin nhìn xinh thật miss việt_nam cũng đẹp chúc_mừng nhật hà đoạt giải video giới_thiệu,0
3403,nữ chính có mắt đẹp party popper party popper red heart,0
