id,text,label
5916,tập được 50calo ăn 10 calo,0
1156,mê người con_gái thực_sự,0
6556,tệ quá thiếu trách_nhiệm bản_thân,0
6657,em đẹp lắm hà ơi,0
6056,vui quá chắc phải lấy vợ được vui như thế mãi,0
2548,con ăn tởm_lợm,2
2795,bà đẹp quá trời rồi bà ơi,0
3282,một mat nu cuong hien mot mat nu tam có smiling face with smiling eyes,0
4276,chị xinh_đẹp quá đi smiling face smiling face,0
576,mất điểm từ áo bị hất thấy mờ ơ mơ hỏi mở á smiling face with hearts,0
1554,chê gì chê chứ không chê body bà châu mỹ latin được nhìn kìa trời nét nét mún thẳng lại lun nè má,0
1917,đẹp gái màaa heart hands,0
4091,anh tú số hưởng,0
6440,sao có_thể tăng cân nhanh thế được chứ ?,0
4711,6 mới che mặt,1
2410,tóc nầy đẹp đừng đội tóc giã Việt_Nam nắng_nóng khó chui nó sẽ dài con phải kiên_nhẫn nó sẽ nhanh lắm bây_giờ nhìn màu tỏc cắt kiễu tém nầy rất đẹp thumbs up red heart,0
4518,tự nhien thích ăn tôm tôm đầy mình = grinning squinting face,0
2805,tóc phù_hợp bạn nhìn xinh,0
3436,đúng câu_vẻ bề_ngoài quan_trọng như thế_sao,0
1888,như_vậy mới gọi đẹp thuần_khiết không tai_tiếng,0
2400,may ma lam on im_cai mieng thui lai gium toi may ma lo chuyen nha may ma_di_chua chac da tot hon nha nguoi ta ha con te hon toc nay thay dep roi con dung vay nhan 10 diem,0
1582,mẻ đứng giữa sửa xong cũng không thấy xinh hơn,1
6265,minh muon map lai không được map cũng kho ma om cung kho,0
4183,ảo thật đấy,0
4441,há miệng rồi nè,0
6687,khâm_phục nha bạn,0
274,40 cân cơ á anh,0
3542,con_gái mặc áo_dài thùy mị nết_na ghê,0
3769,ngt ánh mắt biết nói đầu tao cứ có ánh mắt biết cười giựt mình suýt chút nữa dânhs rơi,0
2052,kíu kíu nói tiếng anh phát 1 chớ ín lịt kíu,0
1725,ê nhỏ xinh thíi,0
6717,qúa giỏi,0
1266,gò_má khắc chếc hết nhà chồng,2
5386,không tì_vết,0
983,tắt app không trang_điểm biết ngay,1
2064,bố con điên,0
4325,xinh gái dễ_thương quá,0
3955,môi phẫu_thuật nhiều giờ nhìn xâu PROFANITY_STRONG,2
7183,sao 8 / 3 toàn thấy vinh_danh bạn chuyển giới nhỉ ?,0
2267,vui quá có món mới chính hãng ăn rồi,0
728,chụy thua xác ướp việc quấn ít băng hơn thôi,0
2438,red heart cho chị 20 gói nhân ơi,0
3735,2 thằn có cặp mắt tối thâm chắc làm video phước đức tiêu_tan chắc không sống được bao_lâu đâu đôi mắt báo_hiệu dương khí sắp hết,2
6965,có_thể có kỳ_vọng cười trang_bị khá nhiều trải nghiệm kỹ_năng tri_thức không có rào_cản ngôn_ngữ thể_hiện bản_thân nâng tầm hiểu_biết giao_tiếp hội_nhập,0
3257,phim bản thứ 3 mình xem mình thích nhất bản trần thiêm tường đóng rất đẹp_trai hơn face with tears of joy face with tears of joy,0
4139,đi gia_đình thuê xe_hơi cho cả nhà ấm_áp,0
1139,sao chân bà nhỏ_xíu đáng yêu_vậy,0
2357,thuong nhiều lam gì cũng thương heart hands clapping hands flexed biceps red heart two hearts red heart two hearts red heart red heart red heart red heart red heart United_States,0
7041,tây ai xấu đâu chỉ họ không biết giữ_gìn bê_tha mới bầy_hầy thôi chứ bình_thường 10 người hết 7 người đẹp rồi,0
5722,vẻ đẹp trông rất giả_tạo chắc make up thẩm_mỹ quá_đà đễ mặt mộc chắc còn thua vợ em,2
6769,vẻ đẹp anh mê_đắm thế gợi_cảm tự_nhiên ít son_phấn tui phán vậy có trúng hông ? thư kỳ cũng hơi hở lợi cô vẫn cười thoải_mái vẫn đẹp như_thường đâu cần mím chi như lưu diệc phi,0
5813,uôi à supper idol quáaa,0
5446,đã thí,0
1293,anh giống như 1 ngọn núi_vậy,0
7085,đúng thực_tế luôn_luôn đi ngược chuyên_trang sắc_đẹp mày bình_chọn,1
5705,nhìn có đơ đơ cứng như ma nơ_canh nguyên_bản đã không đạt yêu_cầu lại còn trát cả cân make up xấu quá ! mình yêu_vẻ đẹp tự_nhiên quá sao ?,2
1227,ê công_nhận ông đẹp_trai thật,0
6603,chia_tay nguời cũ chinh xác rồi xứng_đáng có người_yêu mới tôn_trọng em nhiều nhất có_thể nhé,0
7190,đẹp không tì_vết,0
7295,xin cho hỏi cuộc thi có được phẫu_thuật thẩm_mỹ không ạh ? ai biết cho xin ý_kiến cảm_ơn !,0
7170,chuyển giới thật hoàn_hảo chỉ còn phần cổ_tay bàn_tay hơi manly chút thôi ! . .,1
3830,may con quy nu nay len dong phim gion choi vay phim hoi ky cuc . . et không lam dien vien hoi xau te,0
2660,câu nói đào lan hương rất red heart red heart,0
4390,ôi anh ơi em mỏi mồm quá face with crossed out eyes,0
2481,yêu red heart tiểu_bối lắm nè,0
3886,nam chính nhìn mặt gái tính quá xem chẳng có chút hứng_thú,0
6811,cố giang dù ai ganh gét đố_kỵ hãy mạnh_mẽ giang nhé tôi vẫn luôn bên cạnh cổ_vũ cho giang yêu bạn,0
4908,tao tưởng bầu 7 tháng không á,1
2019,da mặt đẹp xinh liền hà chúc chị học thật tốt nhé red heart,0
578,bộ đồ lòng có cho bọn cam cũng chê quá,0
6807,thôi xong đã đẹp rồi sao phải can_thiệp phẫu_thuật_thẩm_mỹ nữa trông thực_sự khác,0
5998,diễn_viên già bụng phệ mặt nhăn sao hấp_dẫn bằng trai hàn xem,2
2989,số 4 chồng em nha cấm ai dành nha biting lip smiling face,0
1083,mỏ vẩu thấy gớm,2
1408,giống tiểu long nữ PROFANITY_STRONG,0
3999,tội anh tú,0
4225,ngồi vừa tầm luôn grinning face with sweat grinning face with sweat grinning face with sweat,0
415,thêm chổi bay được !,0
3680,nhìn mặt thầy như . .,1
4146,kiếm đủ tiền hãy trở_lại người bình_thường em nhé hãy nói_chuyện cô_đơn không cô_đơn con gái thích đàn_ông giàu sạch sẽ đàn_ông củng,0
1922,lâu lắm rồi mới nghe lại giọng bé thuy red heart em đang tokyo huh ? có dịp tokyo sẽ gọi em nhen mình làm_quen nhé,0
4094,chị ơi ôm ôm,0
5303,tại_sao trai đẹp lại bot ? loudly crying face loudly crying face loudly crying face,2
7244,áo_dài đẹp mang dáng_dấp thời vua chúa chúc_mừng em cố em nhé,0
4923,xem angela phương trinh từ hồi kính vạn_hoa dẫn tui từ yêu thích khiếp_sợ,0
1961,thuỵ dễ_thương quá à red heart,0
3453,ờ chân ngta dài thẳng_tắp còn chân mình chỉ cắm cho đủ bộ_phận face with tears of joy,0
4645,chị ngày xua đep lam,0
4970,đẹp,0
2017,vlog đi chị đẹp red heart red heart,0
7119,cuộc thi tay_nghề nhà phẫu_thuật,0
3944,bạn có đôi môi ám_ảnh quá,2
6208,giảm 50 kilogram tao vẫn thấy cô béo,2
3602,diễn_viên nhiều người xấu quá hic nhân_vật nữ mặt nhìn như_nam,2
6616,hân tri ân người_yêu cũ đã cho em động_lực có ngày hôm_nay nhé nay 20 / 11,0
1697,sweet thật cụ_thể tiểu_đường,0
3790,chị việt giống_lai hàn á đẹp quó red heart,0
4195,giống ai đâu có cặp smiling face with hearts,0
1586,thiên_ân make tone nhìn trẻ_trung xinh quá,0
4464,thánh chỉ tới smiling face with halo,0
5118,đẹp quá chị,0
6587,có câu showbiz Trung_Quốc có 2 thứ không phải nghi_ngờ diễn_xuất châu tấn sắc_đẹp phạm băng băng xét khía_cạnh diễn_viên mình thích châu tấn hơn một_tẹo bởi_vẻ đẹp một diễn_viên nằm năng_lực biểu_cảm hơn tỉ_lệ vàng đường_nét khuôn_mặt,0
5017,vậy mới đẹp,0
4235,hưu duyên bl smiling face with hearts,0
6845,nhớ mãi cô autumn in my heart,0
2621,gp rất giỏi,2
3485,bả piến thái_vậy,0
5558,ước chị rep 1 lần pleading face,0
5743,trông giả quá,0
4461,squinting face with tongue,0
6252,trẻ đẹp thật !,0
1418,xin vía ốm như chị_gái,0
5697,lê âu ngân anh_em rất đẹp anh thích em,0
5715,sao em nhìn hoa_hậu cứ giống ai bác ạ,0
4694,chắc mình tao thấy 6,1
3766,mắt có màu cũng giả skull,1
1720,không còn gì neft disappointed face,0
1221,không dám khen cute lun,0
4708,không đẹp cũng không xấu bình_thường,0
4480,face with tears of joy,0
5831,nhìn muốn đẻ luôn,0
2204,ủa bà đang live bay đi nhật sao hien đang live anh rể sao sân_bay đi nhật trước,0
6615,người_yêu mới sau_này cũng nhìn cơ_thể_hiện_tại bạn bạn mập không_khéo lại chia_tay khó xác_định được đâu phẩm_chất tốt_đẹp con_người cho_nên bản_thân mình cố_gắng cho mình chính_xác nhất đừng lấy cớ người chê xấu người khen đẹp đổ lổi cho động_lực phấn_đấu bản_thân mình cố_gắng cho chính mình,0
2018,dễ_thương ác ; 3,0
5758,nhìn chán không chứ nệ,0
2422,tôi nói thật bà nhân làm đại_trà quá lại làm cho lớn luôn không à có ngày bà nhân bị công_an mời bà nhân làm_việc à,0
4172,ế nhờ thực_lực,0
342,tui mê bả,0
2580,sao mình thấy bạn comment nhũng lời ác_ý không có chút thiện_chí chắc tâm bạn đen_tối không có chút_xíu lòng thương người,0
2363,chùa đẹp quá bối dễ_thương chúc gia_đình may_mắn,0
1424,có cần xinh như zậy không hả chị đẹp face with peeking eye face with peeking eye em không giám nhìn đou,0
4211,sắp sắp hết nhận rồi,0
713,ngày_xưa men thế giờ nhìn rolling on the floor laughing,0
860,có_chửa hả má,2
922,2 nàng đẹp gái đã vậy còn đẹp giống nhau nữa như 2 chị_em vậy á,0
1088,người_ngợm gì nhìn như cin khỉ,2
6808,người nổi_tiếng có khác có bầu cũng đẹp có bầu ai_nấy đều biết,0
4412,không quỳ sao nhỉ,0
3825,ăn 1ki giảm 1 tấn face with tears of joy face with tears of joy face with tears of joy face with tears of joy,1
410,22 tuổi thấy đứng quá,0
35,em cũng rất xinh rất rạng_rỡ pink heart,0
1061,bà xinh chắc cả thế_giới không có gái 6 =,1
7277,lắm hoa_hậu_thế,0
2992,4 trai đẹp smiling face with smiling eyes,0
4070,ông tú số hưởng,0
7022,bảo ngọc rất xinh riêng chiều cao vượt_trội thế mạnh rất lớn em rồi !,0
566,ăn mạnh anh ơi dạo gầy nhiều sa_sút,0
4173,kêu cạo lông nách đòi chia tayy gì cũng muốn không chịu thay_đổi grinning face with sweat,1
433,nhỏ đớp ích thôi,1
3968,dạo mập quá nha_ku,2
448,vậy chứ cụ muốn cũng không được á,0
1820,da trắng nổi phải giảm sáng lun í,0
4401,ngày liền face with tears of joy face with tears of joy,0
7212,có giải_thưởng top 8 luôn ạ tôi thấy lạ có top 17 top 14 gì vậy có top 101 không ạ ?,0
5672,thấy vòng eo bà bán quần_jean nhà dokimquyen chua bro,0
938,chế chế nấy đẹp phát hờn,0
6537,body chuẩn quá,0
3288,ô số 3 còn ok kiểu không chỉnh app gì cả chứ bạn cũng bthg có app gánh hộ,1
6765,không đẹp quá đẹp,0
341,nay ký dễ_thương lắm nha cục cưng !,0
6551,từ dáng_vóc đẹp như thế_mà có_thể mập vậy mập xấu,2
4889,như bầu 3 đứa,1
2923,nay xinh quá eo thon nuột_nà,0
1555,body đồng_hồ cát làm nhớ tới mu_paulina,0
211,thi_thể mới xứng nam vương,2
6726,em tấm gương sáng ngơì cho thế_hệ dễ béo phì thời_đại hôm_nay đâu cũng có gà ráng gà xối mỡ khoai_tây chiên ! anh thích ý_chí em hơn hết !,1
331,rối_ren hung em,0
6595,bỏ phấn_son cô bthuong gầy so tiêu_chuẩn mih thik nhất mái_tóc thàn_thí cô,2
5230,tui lại thích làn da gương_mặt mộc_mạc trước hen hơn gu thôi nhỉ,0
6826,đẹp hát không,0
5108,đẹp nhức nách quá bà_con ơi,0
887,xấu nhất thế_giới,2
59,10 người 1,0
1207,nhà thiếu ăn hả bạn,0
4957,bà bao_nhiêu tuôi ròi ta gu giong con tui nó 8 tuôi ròi,0
389,con bé bên châu phi chứ Việt_Nam đâu to_thế,1
4495,suỵt,0
4715,body cũng bình_thường mặc bình_thường,0
296,khoẻ ác,0
4409,đừng có thách quỳ liền nè person kneeling,0
1249,đủ rồi đừng giảm cân nữa xin đấy,0
4363,quý không bù được không anh,0
6154,tuyệt sắc giai nhân rồi,0
3088,thích ông mặc vest mang giày tây nhất đậm chất men lì,0
677,chị thục séc xi quá như thư_ký không thấy già ngày_càng quyến_rũ,0
1238,mặt ẻm có cọc quá hong rolling on the floor laughing,0
5316,nhớ hồi cấp 2 lướt thấy video anh cười say nắng luôn tới giờ vẫn nhớ =,0
2144,chị ơi được chị quay thêm vlog bên nhật được hôm,0
1717,đcm quả lông nách bảo cạo không cạo,1
1231,tóc bạn đi đâu hết rồi,1
7042,em việt nam không so được phải top 15 toàn đẹp ngút_ngàn riêng hoa_hậu quốc_tế đức chuẩn mi 2022 rồi đẹp hơn cả nữ diễn_viên nổi_tiếng diane kruger,1
4659,ai có grinning face with sweat,0
6430,bác anh thấy sao tôi không biết tôi lại thấy mũm_mĩm vậy mới đẹp tự_nhiên nè gu tôi gu tôi,0
7327,ngày_ngày hoa_hậu hoa_hậu nhiều hơn người phàm,0
1501,slay thấy ghê,0
2598,vậy mới nói,0
3067,bảo ngu lại tự_ái,0
3619,đồng_chí có súng to quá cộm luôn,2
5779,mắt lác cũng lên_ngôi vương,2
2557,ăn gì như heo_vậy …,2
4752,tao nhớ đợt show mặt lần đầu bị nhiều người chê thẳng luôn,0
4703,6 full moon face,1
1179,đối_với tao như_vậy chưa đủ đẹp,0
4636,đã bảo tết mặc rồi,0
1977,chị làm 1h luôn cho em coi được hong ạ,0
3193,vợ người_ta đẹp còn mình xấu,0
1412,sao lại xinh như thế nhỉi face blowing anh kiss,0
4729,sao giới trẻ giờ gu thẩm_mỹ thấp thế nhờ relieved face,0
7200,em rất đẹp nhìn em rất hợp đóng phim cổ trang như hoàng_hậu quý phi rất hãnh_diện em đã đại_diện cho Việt_Nam !,0
3171,bà chị tề chu slay quá tui mê luôn rùi,0
1952,chúc_mừng_tuổi mới em party popper,0
6628,sau sinh như thảo có bị tăng cân nhiều không điều ý giảm đi sự xinh_đẹp xinh sang thật ý !,0
1180,chị dễ_thương chứ không đẹp smiling face with smiling eyes,0
1288,không phải kì_thị con gái ngực lép khác gì đàn_ông đâu,2
5289,thua lowg,0
5728,mình ngắm thôi bạn ! còn đẹp không mắt củ người,0
3253,che khăn nhìn thùy mị hiền_dịu mở khăn mặt đúng phản_diện face with tears of joy,0
2846,eo thon,0
4615,đầu tưởng xông dìa,0
4438,không dám hét to smiling face with open hands,0
3727,mĩ nhân thời xưa chả đẹp tới mức đâu đem so_sánh chỉ ưa_nhìn cả bây_giờ toàn mĩ_phẩm xịn app xịn,1
7038,má ơi con tìm thấy vợ rồi,0
1559,phải nói woww lun á body mơ_ước,0
1682,mình hỏi thật bạn fan đừng giận mũi bạn sửa rồi phải không ạ red heart,0
1188,thơm_phức dậy,0
283,40 kilogram cả bỉm cứt,0
6243,nhan_sắc hoa_hậu Việt_Nam_đây sao ?,1
3243,tu tiên giờ dễ quá nhỉ phấn_son điện_thoại cộng 1 đống app làm_đẹp thành cảnh_giới cao nhất từ tiên,1
453,ngừoi mõng dánh cũng khoe,2
2678,anh_hùng dz phết face with tears of joy,0
4430,dạ quỳ loudly crying face fire,0
4013,bé tú lâm vlog kìa,0
2416,chào su … con đừng buồn … con mua may đồ cài tóc có hoa có kueu … rồi con mua máy_cày kẹp kiểu . . tóc . . thi con sẽ thấy đẹp ! tóc con sẽ le . . con đừng buồn_nhe god bless red heart red heart red heart dove rose sparkles smiling face with halo folded hands,0
3814,trùm cuối đáng yêu ghê ghê thấy bà face with tears of joy face with tears of joy face with tears of joy face with tears of joy,1
5500,xinh dữ má ơi,0
6739,đẹp lắm em !,0
4737,từ lộ mặt đã thấy thường rồi seeding khen qtqd upside down face,0
3343,ủa béo tội à face with raised eyebrow thinking face thinking face thinking face thinking face thinking face,1
2197,em bối thông_minh dễ_thương quá đi ! chúc gia_đình bối thượng_lộ bình an …,0
1401,con bồ mình cao mét 50 nặng 60 kilogram cũng đòi mua calavat tập,1
6827,photoshop quá_đà đá biển còn mịn người sao không lung_linh,1
3476,có chân khoe chân đấy bộ không thấy hả,0
2700,mặt ông đại nhìn tiểu_nhân sao í grinning face with sweat,0
3085,chị số 1 hơi lùn face with tears of joy face with tears of joy face with tears of joy,1
2595,rất thích cặp đôi fb bị khoá không xem được,0
4534,ối bà mất liêm_sỉ trend có tui smiling face,0
1474,ngậy tuyệt_đối,0
3856,đúng quyền_lực sắc_đẹp sự kết sự thông_minh nó,0
4263,lâu lắm rồi mới xem video chị không nhận lun,0
6482,nhan_sắc bạn bình_thường thôi đội_tuyển nữ nói về xinh_đẹp không được kiều trinh còn tài_năng sao sánh được thanh thuý,0
6677,mập mập dễ_thương nhỉ,0
3062,việt nam không phải vũ_điệu lăng_quăng việt nam vũ_điệu lung_tung huyền face with tears of joy,0
3974,nữ 9 thấy cứ vẩu vẩu nữ phụ cố make up đậm dìm nma xinh hơn,2
1723,thay_vì đăng xàm xàm xin hãy giảm cân rồi nối giõi gia_tộc đi,1
4771,PROFANITY_PARENT như con nái,2
1133,sai xinh ghíu,0
1313,anh khỏi mua đồ nạo dừa mỏ anh làm được hết,2
4323,mình dây vẫn gi rolling on the floor laughing rolling on the floor laughing,1
1919,mới gặp mẻ xinh_đẹp haneda chỉ kịp cảm_ơn mẻ luôn mang năng_lượng tích_cực vui_vẻ cho mng quên nhờ selfie chung giữ lại kỉ_niệm xinh_đẹp tuyệt_vời ê nay đẹp gái dữ lắm nha,0
3684,má nó nhìn mặt kìa,0
984,sạo sinh năm nhiu u40,0
895,chị hân không tha son đánh_phấn đẹp hơn ngày,0
5171,nàng hậu cá_nhân tôi thấy body số 1 việt nam đỉnh lắm em smiling face with hearts smiling face with hearts,0
4894,tưởng có bầu không á chị ơi,1
3813,bộ_mặt thật đứa nói_xấu face with tears of joy face with tears of joy,0
2265,người_ta làm quy_trình có đeo khẩu_trang bao_tay máy_móc đàng_hoàng má cứ hù hoá_chất gia_vị ớt bột cũng một loại nguyên_liệu bán thị_trường thôi miễn đừng mua nguyên_liệu giả được má ăn đồ đóng_hộp thực_phẩm đóng_gói snack mì gói nước_ngọt cũng một phần có chất hoá_học cả quan_trọng không tỉ_lệ an_toàn cho người sử_dụng được,0
3033,đẹp bọn nó lại chê,0
400,ê hơi bị khó_coi á smiling face,0
5041,ngưỡng_mộ quá chị ơi,0
3220,ông số 2vs3 đẹp rồi ông số 1vs4 mới đẹp tuyệt_trần,0
2045,xin clip đánh son chị ơi quả môi nay đẹp sức sắc smiling face with smiling eyes smiling face with smiling eyes smiling face with smiling eyes,0
2318,nhân có bà vú dễ_thương quá,0
3580,gay vãi,0
3449,mặt baby cơ_bắp cuồng cuộn luôn á face with tears of joy face with tears of joy grinning face with sweat,0
6178,không xinh tí,0
416,thảm_hoạ sắc_đẹp,1
6762,dao kéo nhiều quá không còn vẻ đẹp tự_nhiên !,1
5889,cô sẽ thay_đổi,0
2254,thuận hiền_lành có phước có được cô em_gái rất tuyệt_vời smiling face with hearts rose party popper maple leaf hibiscus blossom cherry blossom four leaf clover thumbs up,0
1085,mỏ dài 10m,1
3581,trai_gái không quan_trọng miễn sướng được speaking head,0
1075,kiểu cười làm mặt trông méo_mó,0
5332,thành đẹp thường bot,1
2475,bối thông_minh,0
1443,trắng quá sao chân muỗi đốt quá_vậy,0
5897,không_thể xem nhẹ cô được,1
1512,ủa tt tăng không à ? trước chân thon nuột lắm á không như_thế_nào,0
1611,thằng tin mặc bộ đẹp vãi í,0
4839,thấy lỗ mông tao còn không gớm bằng trà bông moai,2
4835,gớm vãi iồn,2
5736,kết vẫn một gương_mặt nhựa,2
1165,giờ treo cung chân_mày cũng rẻ lắm chị,0
1394,có tiền đắp công_nhận đẹp mình không có tiền đắp sấu cũng phải chịu thôi,0
5233,nhìn cặp đũa chị_em nín thở . . cười em thích chị,1
5655,không có ý toxic ngọc trinh rất cố_gắng hoàn_thiện bản_thân sau bị tạm giam mong thùy_tiên sẽ được như ngọc_trinh,0
5958,đúng lột_xác em đẹp lắm chúc_mừng !,0
3526,như con_gái lầu xanh thèm trai mặt dâm,0
2136,u trời chị đẹp gái quá trời,0
2583,bọn làm_thuê nó bảo ăn thế_là sang no rồi,0
2994,toàn trai xinh gái đẹp red heart red heart red heart,0
4909,tao nhìn tưởng nó đi đẻ upside down face upside down face upside down face,1
2657,tịch_thu tai sàn xung quỷ nhà_nước giúp_đỡ người nghèo,0
3881,lông_mi ông n9 dài dã_man,0
747,nhìn như ếch vừa_lột da xong,2
3389,thi_thể không phải cơ_thể nhé,1
5815,nhìn như tắc_kè =,0
4900,tưởng có bầu không á,1
7172,isabella santiago venezuela phẫu_thuật bị lỗi sao còn nguyên kìa kaka,2
2088,mùa hè năm 25 tuổi đẹp gái quó cô bé ui = ] ],0
5973,làn bơi xanh kình_ngư bờ nàng tiên cá,0
746,mình không có ý phê_phán phải nói lời thật từ đáy lòng nhìn như cc vậy không đẹp 1 chút cả thô_kệch xấu_xí,2
1638,tao coi cũng mong tới cuối phim hồi_sinh đẹp_trai chết sớm quá trời,0
226,nhìn giống minh béo nhỉ,1
4988,bg coi sao thấy sợ á,1
1992,đồ ăn nhật mãi đỉnh,0
7010,thi hoa_hậu làm gì vậy ?,1
5451,xinh qué,0
5839,tự_dưng thấy chồng bọn mình chắc cũng on top,1
2506,cách cách tiêu boi nhảy thương quá yêu cách cách tb nhiều nhiều hì hì,0
3637,ông huấn_luyện_viên mới vô như chupin vậy á,1
829,ngày_xưa còn thấy bạn xinh chứ giờ thấy xinh vô_cùng yawning face,0
768,beautiful xinh quá đi nè người đẹp ơi,0
4185,hoàn_cảnh giống mình ghê đi đâu cũng đi 1 mình flushed face,0
4206,độ khoe miết face with tears of joy,1
84,tôi bắt được cá_mập lào,0
2453,chúc_mừng 2 vợ_chồng nhân chúc thành_công hơn nữa càng ngày_càng tiến xa hơn nữa red heart,0
6305,vp kate cứ tóc dài bóng mượt dù xõa buộc đều gọn_gàng chỉnh chu tui kết bất_kể màu tóc gì,0
862,ông cố tao ơi múi không luôn chèn ơi,0
3816,trùm cuối đôi môi dành cho rắn_độc,0
5474,dễ_thương dữ trời,0
6437,người muốn tăng không tăng được,0
3893,tay rất đẹp sao tôi cứ thấy giống chân gà grinning face with sweat,1
6631,trời đẹp quá mập được đẹp như vậy ai cũng muốn mập 1 điều tôi thấy dáng càng đầy_đặn càng sang gầy nó mất sang sao á,0
1844,nam_tính + nụ cười ngọt_ngào = > combo trí_mạng vương thiên_thần,0
4616,nhìn thoáng anh_trai tưởng trình trình smiling face with hearts,0
6659,đẹp quá đi mất yêu chị mãi,0
1787,ngầu thiệt giống yên xe_đạp địa_hình nha,1
1568,cười có cặp chân đẹp nhất Việt_Nam,0
1147,ăn nhiều ông tạng người khó tăng cân tăng được một mức đẹp dã_man chúc ông thành_công nhé,0
3432,hài thật bố béo thay mặt còn dáng sao ít_ra cũng phải gầy chứ rolling on the floor laughing,2
510,huyết_áp bao_nhiêu rồi con_trai,0
155,ổng tự_tin thần_thái_quá,0
356,đẹp bạn nó hơi lạ,1
446,cơ không thấy thấy xương không,1
1452,mái ngố không hợp mặt tròn nha em thay_đổi mái pháp,0
1864,vẽ đẹp đánh_đổi cho sự khổ_luyện,0
3615,nữ_chính nhìn mặt mũm_mĩm nu8 mặt nhìn bần_cùng quá,0
3373,trời ơi hơn cả hồng tỉ,0
4043,tay bro làm_gì vậy moai moai moai moai,0
6733,tôi rất đẹp tài_giỏi,0
1275,liếm màn_hình chụt chụt,0
6688,người cần thấy mình đẹp nhất mình lại chẳng bao_giờ quan_tâm suy_nghĩ anh,0
1525,mộc chổ ? son_phấn tùm_lum kìa,1
697,ai tiêm cho bả càm_vậy trời ơi crying face như cũ đẹp hơn,1
4020,sao có ai dị,0
2576,tui thích coi baby dễ_thương ghê,0
6288,nhìn hương ghê quá nhận không lun !,2
5040,tiếc quá năm itv tiếng anh đỉnh đủ dùng cơ_bản win rùii,0
2768,con nhỏ áo hồng nhìn ngon quá,0
2046,quá trời rùi,0
4624,giống trình trình_vậy,0
22,làm_sao có được body như rolling on the floor laughing,0
4150,pleading face đúng như vậy mình bị bỏ lại một_mình,0
5996,theo tui xấu,2
5490,chời,0
5129,xuất_sắc quá hen ơi smiling face with hearts smiling face with hearts,0
6744,em đẹp không bằng ngô thanh vân anh,0
7139,phải nói quá đẹp ý mình con_gái còn mê huống_chi đàn_ông con_trai,0
152,lướt tới bài đth cứ nặng nặng g mới biết tại_sao,1
1437,trai 1m7 chê nhá,2
