id,text,label
2584,trả ma dám mua lại hạ giá có cho cũng trả ai dám ăn chứ nói gì mua ai biết nguồn gồc có từ da con lợn dịch_tả lọc về tẩm ướp rút kinh_nghiệm từ hoàng hường đời trả tin_tưởng được khuất mắt trông_coi thôi rút_ruột tiền từ thiền mua_chuộc bảo_kê thuế không nuôi được bảo_kê thuế nữa ngta mới khai công_an kết hoàng hường đấy chứ đâu trả ai chân_chính nuôi được chục con_người trừ nhà_nước,0
6008,anh luôn theo_dõi em em sản_phẩm mới một cô gái xinh_đẹp hát rất !,0
2478,gia_đình em nhân anh teru cũng đi từ_thiện thăm trại trẻ_em mồ_côi lại rất dễ_thương ạ red heart smiling face with smiling eyes smiling face,0
4948,có ai như tui không nhìn thấy giao_diện hiện_tại bả nhăn mặt nhíu mày flushed face,0
7425,nhìn cằm sợ quá,2
3101,tui con_gái mê gái,0
2971,thiệt nha pà nay thấy đẹp gái thiệc,0
2871,mỏ ăn rất duyên,0
5763,thực_sự có đẹp thật chưa ? thật_sự nam vương chưa ạ,1
6494,66 hả ? 662 chứ vậy chị_em phòng tui under 50 vẫn có_thể xẻ bá cháy nhỉ,1
6665,cung duoc day,0
617,xinh gái nha cán_bộ ơi cười,0
1416,đôi mắt nhìn xuyên tâm_hồn,0
5015,khúc đầu đẹp khúc sau giật_mình grinning face with smiling eyes,0
7096,một_mình tân hoa_hậu thôi cũng đủ sáng bừng cả sân_khấu !,0
4512,bù quý hả smiling face with hearts,0
262,sao tui thấy người_mẫu ngoại_cỡ nó cuốn vậy ta ? tui cũng ngoại_cỡ lạ lắm,0
3188,makeup bi cân thi nang face with tears of joy,0
355,quả bạn siết đẹp cứ có sức_khoẻ đam_mê cho mình thôi còn quan_tâm gì người khác,0
5420,à chắc một phần bài có ý_nghĩa tao relieved face,0
4268,em khác quá em ơi face with tears of joy,0
6643,xinh ! chỉ cần tăng cân thêm thôi,0
1146,cốt vương đại_đế,1
6873,chị yêu_quý em lắm ý ngưỡng_mộ nữa,0
6960,quá đẹp luôn,0
6037,lỗi cô_dâu xấu thôi . . liên_quan gì người khác xinh_đẹp,2
3332,xấu lại còn bày_đặt úp mạng,2
4394,í ảnh bù quý á smiling face with hearts,0
5151,xuât săc smiling face with hearts smiling face with hearts smiling face with hearts,0
7115,em nhìn khuôn_mặt thô gãy nữa không hợp hoa_hậu !,2
5721,khen đẹp không cần phải giải_thích nhiều nói không đẹp phải ghi_chú ý_kiến cá_nhân theo ý_kiến cá_nhân tui,0
7191,hương_giang việt nam đẹp hơn,0
5495,cười_duyên thí smiling face with heart eyes,0
671,khung quay dìm mẫu việt khung quay mẫu việt có quá nh không_gian khiến mẫu bị lùn còn mẫu_tây nhìn cao hơn hẳn,0
1143,mặt cin nhỏ_xíu dthg vãi,0
5024,rồi làm con_trai đẹp zử chưa nhìn nó sao sao ak,1
2906,mới nhìn tưởng đờn ông giả gái,1
2433,bao_nhiêu tiền 1 gói vậy_nhân,0
4963,content cho lạ còn bán hàng thôi bả muốn trắng đẹp nữ_tính được ngay tao thấy cũng đẹp hết á rolling on the floor laughing,0
6901,thật quá tiếc_nuối 2 anh_chị không lấy nhau chỉ sống nhau có mọi thứ lại tốt hơn,0
4827,nhìn như con vịt . .,2
5457,quá đã lun,0
2776,chị pun cứ bị đáng yêu làm_sao red heart red heart red heart smiling face with smiling eyes,0
6802,con_gái cũng xinh như mẹ,0
5376,cho tui info đống khuyên tai cậu đck vậy loudly crying face loudly crying face ?,0
3618,kiệt hà_tĩnh bị lìm choi kìa,0
2770,chị xink quớ >>,0
6681,mặt cứng đơ không cảm_xúc thân_hình béo ục_ịch zậy cũng được mời sàn_diễn nữa sao trời ! hết_ý_kiến,2
1931,mới 25 thôi em_gái . . rồi cũng tới ngày thôi không vội chi,0
1587,eo chữ giờ đi cứ lắc loạn thảo_nào chỉ nước,0
3867,sai đẹp chiêu smiling face with heart eyes smiling face with heart eyes smiling face with heart eyes,0
6502,việt nam nhiều người đẹp lăm khen cả ngày không hết,0
2420,grinning face with sweat mỹ tiền một gói vậy_nhân,0
245,bác cho em địa_chỉ em biết bác chục không đường 10 lớn sữa đặc,0
7086,vô tới rồi,0
2980,tôi cảm thấy thích cô gái như không son_phấn quá nhiều luôn đẹp theo cách mình,0
5588,cổ cười xinh quá_chừng cảm_nhận được sự_tích_cực từ nụ cười cổ lun í,0
802,sao phần quai xanh bè thẳng được vậy_ta,0
4717,công_nhận từ hôm thấy 6,1
7251,trao vương_miện cho maria perviy belarus ngay luôn tiền tổ_chức thi làm từ_thiện,0
5001,xưa đố ai đẹp phương_trinh,0
4675,cô 2 2 néo cô 4 4 vãi lèo cô 6 6 đau 6 đớn she is 8 8 the whole family cô 10 10 cửa_hàng thức_ăn nhanh sụp_đổ giờ ăn trưa 10 lần vô_địch hạng nặng 10 % trọng_lượng trái_đất 10 loại bệnh tiểu_đường 10 chỗ ngồi máy_bay 10 lý đo phòng tập_thể_dục 10 bước thoát khỏi sự kiệt_sức 10 người 1 10 lý đo cho nạn đói thế_giới 10 lần ngừng tim 10 phần_trăm lượng máu tuổi_thọ 10 năm 10 0 calo ngày 10 % khả_năng đi bộ 10 bước giờ mang thai 10 tháng 10 phút sau cơn đau tim 10 lí_do châu phi không có thức_ăn 10 combo gia_đình 10 chữ_số cân nặng 10 suất ăn nikocado avocado 10 lần sức hút hố_đen 10 người ngồi cạnh cô 1 10 tế_bào ung_thư 1 cm3 10 richter động_đất 10 điểm xảy động_đất mạnh nhất 10 bộ phim kết_thúc đi ngang tv,2
2069,troi ơi chị dễ huông,0
7127,nhìn rất đẹp nghĩ tới à thôi !,1
858,đầu bả đủ dầu lấy rán cá được,1
7057,mọi dự_đoán trang quốc_tế sai hết,0
6400,vinh_dự càng cao trách_nhiệm càng lớn,0
469,như vậy_mà xinh không còn ai xấu nữa,1
2210,ngồi che hết người chồng thế cháu chồng ngồi thế sao được không đẹp tý cứ như sợ mất phần ăn vậy rút kn nhé,0
7428,tôi chị tna luôn đẹp dù thẩm_mỹ không không quan_trọng đẹp quan_trọng chị đã làm gì ghi dấu_ấn theo thời_gian như thế_nào !,0
4346,em quỳ roii ckk oii broken heart,0
64,10 0 calo ngày,0
4418,quỳ rồi nè mệt ghê,0
7196,chúc_mừng tân hoa_hậu,0
530,lấy v1 không tao chia cho bớt nè,1
122,tấm hình 120gb,0
7128,trắng_đen lẫn_lộn chết mất,0
2387,nhìn giống pe quá cứ đăng chỉ_tội_nghiệp nó . . !,0
1341,bả đẹp zữ chưa,1
526,có em tự_nhiên không độ loa,0
2081,smiling face with hearts nhìn bà tích_cực > <,0
3035,bộ trước giờ bả đàn_ông sao giờ mới đi làm gái,0
3463,chân tao thô như đàn_ông íi,0
6156,bà đẹp quá kiểu đẹp người á đông,0
7211,nhìn cằm không tự_nhiên chút,0
5918,tập xong ăn luôn phòng gym,1
2696,tập ân có biệt_danh ân trai grinning face with sweat grinning face with sweat grinning face with sweat grinning face with sweat,0
6910,đúng người chồng ngoại_tình buồn cho nữ diễn_viên đã chọn lầm người ly_hôn không có gì phải hối_tiếc phu nữ ngày_nay hãy vững_vàng biết sống cho mình,0
1400,em xịt máu mũi tới nơi =,0
4372,flushed face flushed face flushed face flushed face ek chịu_thua,0
6998,dự_toán toang,0
3086,má tao nghỉ chắc ổng đẹp_trai lém ó,0
856,da bả đẹp_vậy trời smiling face with heart eyes,0
2454,bao_nhiêu 10 goi vậy_nhan,0
7222,tôi thấy không đẹp bằng việt nam mọi người công_nhận không ?,0
2199,su rất dễ_thương hiền_lành,0
6636,80 ký nghe to so trung_bình phụ_nữ Việt_Nam mét rưỡi thôi chứ người_mẫu cao tận mét bảy nó vẫn bình_thường dáng đầy_đặn quý_phái + gương_mặt sáng = vẫn ngon_lành cành đào,0
1253,vid cứ bị bí bí bí phèo,1
2060,nữa nữa báo quá bà thơ grinning face with sweat smiling face with smiling eyes,0
3390,lão nô bộc diễn_xuất rất gương_mặt đủ biểu_cảm rất hài,0
7290,nhật hạng 3 belarus nhì mexico nhất,0
1411,hong có gì chê smiling face with hearts,0
5380,bé ơi răng bé có niềng không vậy đều đẹp quá,0
6388,thần_tiên tỷ tỷ xinh_đẹp,0
4052,lê_tú thắng đời 1 0 chưa,0
2283,đừng đi quá xa nha đừng đồng_tiền đi quá xa nha,0
3875,nam_chính đẹp diễn hơi nhỏ_con gầy quá nhìn nam_chính nhớ tới lvhi có tất_cả hơi thiếu thịt face with tears of joy,0
5668,nt u40 rồi vẫn đẹp ngang hoa_hậu zay nó mới xịn sò,0
4307,mặc gì vậy chị,0
7313,tiếc cho nhật hà việt_nam,0
1619,hai đứa đáng yêu quá !,0
934,răng khểnh xinh quá trời luôn trời,0
7044,tôi không thích xinh_đẹp như búp_bê vẻ đẹp cứng_ngắc không sinh_động tôi thích dung_nhan xinh_xắn thần_thái riêng thật dễ_thương khiến tôilặng nhìn em thương em hơn thương em mãi thần_thái in timkhông muốn sau_này quên_lãng,0
6010,có đẹp bạn không nhìn thấy được . . như phong_cách giao_tiếp phong_cách thể_hiện người_ta,0
838,tao tao thấy không đẹp thấy ớn vlin,2
1875,maria mặt mộc thôi cũng đã đẹp thiên_thần rồi,0
5885,thánh đớp ! ! đớp luôn khái_niệm chubby,1
2461,mì 10 gói,0
3487,chân tay da người mặt back cost tinh,2
4868,heo nái nhảy,2
809,múp dạ trời_ơi,2
5991,không phải gu thời_trang mình hiểu_vẻ đẹp đặc_biệt vô_hồn kiểu mặt cứ trừng_trừng ý,1
859,bóng nhẫy ra_vậy trời,0
3982,lê tú số hưởng,0
5389,vô trang thấy video xinh,0
6151,về nhan_sắc so bây_giờ gọi đỉnh đỉnh tôi thấy không hợp_lý tôi thấy thứ duy_nhất bà khác_biệt khí_chất con nhà quyền_quý chứ xét về nét mặt chỉ mức hài_hoà,0
6818,vấn_đề không phải đẹp xấu em dám đối_diện sự_thật không trốn_tránh có bao_nhiêu người_làm được như thế em đã hoa_hậu lòng mọi người Việt_Nam,0
7002,nhìn góc nghiêng hg mới thật hoảng_sợ,2
2649,tui cũng o ưa gì ba dân bộ nha face with open mouth crying face grinning face with sweat,0
4212,lại phải chipmunk jar,0
2957,dạo thấy bả ít mụn hơn rồi showbiz biết làm_đẹp liền smiling face with smiling eyes,0
5524,đẹp quá chị mai ơi chúc chị nhiều sức_khoẻ học_tập tốt ạ smiling face with smiling eyes smiling face with hearts,0
4245,khác thật_sự,0
1896,đôi mắt nhát ma,2
5334,càng nhìn càng ghen_tị chứ có thấy mang đong lực đau ! loudly crying face,0
2269,làm gì cũng phải chừa hậu về sau nhiều người ham nhiều tiền bất_chấp sức_khỏe người tiêu_dùng họ làm không nghĩ con_cháu họ phải trả nghiệp họ tạo thời_buổi bây_giờ đừng bao_giờ tin người nổi_tiếng quảng_cáo bất_kì một thứ gì phương_châm sống tui muốn mua gì siêu_thị mua hạn_chế ăn thực_phẩm sản_xuất nhà_máy ưu_tiên rau củ trái_cây tươi người_ta thường nói bệnh từ miệng họa từ miệng vì_vậy cẩn_thận gì đưa cơ_thể,0
1507,nét đẹp người tu tập nó vậy anh smiling face with halo,0
347,em áo trắng lại còn lại cút hết,0
6529,đổi không đổi cũng vậy thôi !,0
1342,như tỉ tỉ bên trung zậy,0
131,mắt biếc ngày nay thành mắt húp à,2
3084,toàn trung_bình m5 yêu m8 nhể,0
6281,không hiểu sao mình nhìn duyên cứ thấy chưa sang tóc lúc_nào cũng bết kiểu như không sạch cảm_giác nha còn mình hiểu rất sạch nhé duyên không có cảm_giác nhẹ_nhàng cứ căng cứng lên_khuôn miệng không tự_nhiên,0
4953,khó chụi vô_cùng smirking face smirking face smirking face,0
6874,em rất xinh có_lẽ gầy hơn trước một_chút_xíu / \,0
5886,anh pt yêu nghề thật,0
5170,trời ơi cặp kiếm chị kìa smiling face with heart eyes,0
5193,chân ơi chân smiling face with hearts,0
7138,vợ mình đẹp hơn 1 xíu,0
2645,tội_nghiệp cho lương bàng_quang không biết kiếm bưởi đâu nữa nhìn hắn khóc làm mình nhớ lại cá xấu khóc sau ăn thịt nạn_nhân,2
5431,smiling face with hearts smiling face with hearts thả trym,0
2838,hồn_nhiên dễ_thương quá,0
4260,dễ_thương không cả nhà flushed face,0
6438,hồn tôi từ thấy ngất ngấy,0
6757,kỹ_xảo ảnh thôi nhìn thật bỏ chạy 60 . .,1
49,đi học cô ngồi cạnh tất_cả mọi người lớp,1
266,tao thấy củng lợi cũng biết thôi không đẹp lắm diễn cũng đơ mặt thần_thánh_hoá bả thế diễn thua cả lâm thanh hà xấu hơn lâm thanh hà được thần_thánh_hoá vãi,0
4586,được không mê trai slightly smiling face,0
1199,nhìn không khỏe_mạnh,0
604,mắc gì đẹp dữu,0
6703,tôi muốn tăng cân 15 năm nay không_thể tăng được,0
4110,cười beaming face with smiling eyes beaming face with smiling eyes,0
6819,bạn đã sống một cuộc_đời rực_rỡ ! chúc phúc cho bạn !,0
5644,xinh qá tag thui,0
4174,cạo lông nách đi rồi có ngiu liền,1
427,tôi đang xem gì thế @ @,0
5571,màu ảnh đẹp dữ,0
2533,nhìn bối nhẩy xong bối bơ mặc quần_áo đáng yêu ghê red heart,0
5022,tiếc cho 1 gương_mặt đẹp,0
5543,chào nàg,0
6248,nhìn khuôn_mặt không tự_nhiên,0
3554,tien it ma doi it lon thom,0
847,môi bị ong đốt à,1
6601,mình nhận thấy bạn nữ béo mũm_mĩm khá nhiều người có nét mặt rất xinh_xắn dễ_thương giảm được cân rất ok,0
6232,mũi chắc phải làm rồi chứ ? không_thể mũi tự_nhiên được,1
7156,hoa_hậu lực điền à,1
4417,khó thở quá,1
3133,yo michael jackson đang làm gì vậy skull,0
3599,nam chính xấu voãi ò không xem nổi,2
7164,holy angel đẹp quá hơn xa hoa_hậu tây,0
5627,xinh qá,0
5745,tin tôi đi rồi cô sẽ hối_hận hiện_giờ cô vẫn không đẹp cứng đơ như pho tượng tới một ngày khuôn_mặt biến_dạng không_thể chỉnh_sửa được nữa coi như sẽ hết cơ_hội,2
2508,nhan dễ thuong ghe red heart red heart red heart red heart red heart red heart red heart red heart red heart red heart red heart red heart red heart red heart red heart red heart red heart red heart red heart red heart red heart red heart red heart red heart red heart red heart red heart,0
3417,mẹ thằng bóng một mẩu tưởng ngầu,1
5499,xinh xỉu ó,0
6406,nhân_văn ghê,0
3912,anh cường có hơi cơ_bắp kìa crying face,0
2983,trai dep chi em smiling face with heart eyes smiling face with heart eyes smiling face with hearts smiling face with heart eyes smiling face with hearts smiling face with heart eyes smiling face with hearts woozy face woozy face woozy face,0
4669,hả,0
542,trộm_vía bà càng ngày_càng nhuận sắc lun á,0
3132,nhìn như thằng nghiện,1
7272,mình thích_vẻ đẹp ứng_viên belarus,0
3175,số 1 nhìn chê chê quá chê,2
3671,miệng kẻ lừa_đảo,0
3219,căng_vậy không sợ gách quần hả face with tears of joy face with tears of joy,1
3708,có ai dống tao không nam_nữ chính đẹp tao mới xem,0
3070,thấy chị_em hot_girl nổi_loạn đẹp hơn smiling face with smiling eyes,0
3250,chị á hề ngầu lòi quá đi mất thui > <,0
1381,bạn vẫn 10 / 10 cô gái xinh_đẹp tự_tin,0
6344,tóc đen sang hơn tóc bạch_kim nhìn như em hotgirl,0
5296,có_thể luỵ tấm đầu cuối đời loudly crying face,0
5054,không_thể gì chê được cô thật tuyệt_vời smiling face with hearts,0
1012,mặt đẹp rồi sao mặt tròn quá zậy,2
4679,chưa thấy xinh baoh,1
1337,tao thấy hõm venus như chị cực,0
5625,rung_động lun,0
745,nhìn mặt khốn_nạn vãi,0
4578,tao thấy thằg đấy đẹp hơn khối thằng rồi,0
7065,xinh so người bình_thường quá bình_thường so đại_diện khác,2
3141,bà đầu_tiên cos đẹp vazz,0
6635,bí_quyết cô có tiền có tiền đẹp thôi,0
7137,vợ tôi mới đẻ có tăng ngót 15 kilogram thôi cô vẫn thua xa vợ tôi về cân nặng nhé tôi thích vợ tôi bây_giờ hơn,0
2571,cũng có nhiều người xem sao bình_luận nói gì văn_hoá kem ce nhà nhìn chị mình ăn ngon_ăn như cũng thấy vui có sao đi nửa nhân ăn lại bình_thường chúc bé nhân luôn hạnh_phúc,0
5683,người đâu đẹp hết phần thiên_hạ à ngưỡng_mộ,0
1766,ý đầu n còn to hơn peach,2
6763,mình lại thích eo to,0
1106,chân ngắn thông mình,0
5764,người không người ma không ma hehe đúng trái cam bu lại chia haha,2
6006,không đẹp bằng vợ tôi,0
2721,chị suzy cute ác,0
885,như cc,0
2368,bối càng lớn càng đáng yêu rất ngoan cưng xỉu con luôn á red heart red heart red heart red heart red heart red heart red heart con được trải nghiệm leo bậc thang cao chùa phật sẽ che_chở cho bối luôn khỏe mạnh khôn_ngoan có tấm lòng nhân_ái như mẹ nhân nhé yêu bối face blowing anh kiss face blowing anh kiss face blowing anh kiss face blowing anh kiss face blowing anh kiss face blowing anh kiss face blowing anh kiss face blowing anh kiss red heart red heart red heart red heart red heart red heart red heart red heart smiling face with hearts teddy bear balloon four leaf clover thumbs up,0
917,trời khu vé kìa,0
3121,nụ cười phản_diện kìa đúng chất luôn face with tears of joy face with tears of joy face with tears of joy face with tears of joy face with tears of joy face with tears of joy,0
6562,gầy đẹp mập trông phúc_hậu thương có vẻ sau sinh con bạn rất hạnh_phúc nụ cười ngọt_ngào hơn rất nhiều,0
1032,tao thề nó đập vô mắt tao ;,0
2707,toàn hồng tỷ face with tears of joy face with tears of joy face with tears of joy face with tears of joy,1
867,bả cao 3 mét bẻ làm tư,1
6062,vẫn quá_ư đẹp_trai,0
4738,mặt cứ tối tối kiểu gì smiling face with hearts,0
5136,đẹp lắm hen ơi đẹp giỏi nữa smiling face with hearts,0
6700,tôi 79 kilogram chỉ ăn rau luộc buổi tối từ 12 / 1 / 2015 4 / 9 / 2015 buổi trưa ăn bình_thường sáng ăn sáng bánh_mì phở chiều chạy bộ 4km tập dụng_cụ công_viên 30p sáng gập bụng 50 kết_quả chỉ giảm 4 kilogram người săn chắc hơn khỏe hơn chạy bộ không còn thở_dốc đứa em tập chế_độ tương_tự cũng chỉ giảm 2 kilogram chưa nghe nói giảm 26 kilogram 2 tháng bao_giờ,0
3733,cuoi xau vai,2
748,tóc dài quá anh,0
5963,giống người_mẫu hoa_hậu quá ta !,0
6292,hương_giang trang_điểm hơi có vấn_đề lẽ_ra không đánh mắt tông hồng như thế nó càng tương phải vùng trán quá trắng trông mất tự_nhiên quá,0
2530,chúc chị luôn_luôn vui_vẻ bình an nhé,0
1894,mat nhìn lòng_trắng nhiều sợ quá,0
1523,ơ chân cong thế nhỉ,0
7359,thế gọi mặt mộc chỉ tô_son,1
4789,đồ ăn tb ai ăn đủ năng_lượng cả năm nhỉ clown face,1
21,ốm như ma cây đẹp gì,2
3359,tui được thằng crush hỏi ngược_lại mày có thích tao không,0
1824,vậy chứ đẹp_trai nó khen ngay à,1
3292,anh sơn đẹp gái quá trồi face with tears of joy,0
741,sao nhìn giống đàn_ông vậy,0
780,chị nhìn như 1 nữ chiến_binh < 3,0
4897,bầu 9 tháng hả . .,1
3724,bao_nhiêu lớp kem vậy face with tears of joy face with tears of joy,1
2762,chương_trình thánh ăn team quên bạn dương mập rồi,2
5219,vẫn đẹp red heart,0
2151,em đg phân_vân có đi du_học balan không nữa đi dh balan em được học_bổng toàn_phần không mất phí đổi lại nó cũng có nhược_điểm em nghe nói tiếng balan vẫn chưa phổ_biến Việt_Nam mình em sợ học xong muốn về nước làm cũng không có việc_làm liên_quan tiếng balan em thực_sự rất phân_vân,0
3052,bà_cô áo xanh kiểu thằng lên_cơn à ?,0
2279,chồng làm kĩ_sư toyota giờ kêu về làm mì tôm,0
5646,định_nghĩa nụ cười toả nắng sparkles red heart,0
4465,quỳ đi,0
2631,gương_mặt hình_thể quá đẹp chắc_chắn mai hoa sẽ trở_thành một hoa_hậu cho bà trang lê tự_hào,0
7088,hoa_hậu có gương_mặt sáng_ngời quá đẹp luôn !,0
2706,ui ông toàn xinh gái quá face with open mouth face with tears of joy,0
973,nách siêu trắng,0
1763,người que đời thật hả,1
5082,đẹp quá ! mãi đẹp mãi yêu !,0
4525,cỡ,0
1783,ngon quá y heo rừng kho măng,2
4535,ảnh ngồi d kiu mình quỳ quỳ làm gì vậy ạ smiling face,0
5516,em bức tranh hoàn_hảo nhan_sắc ngọt_ngào tâm_hồn hiền_lành_trí_tuệ sáng_ngời,0
3313,tín sơ_mi xấu,2
5844,tý nuốt luôn phòng gym rồi không ai cứu được đâu,1
7146,xinh_đẹp rất khả_ái !,0
4588,để_ý video nhảy cũng nhìn đất,0
104,em giống búp_bê quá ! chị thấy yêu ngân nè,0
5834,tự_nhiên thấy chồng mình cũng dễ nhìn,0
873,nhìn mài như nái_sề 10 lứa,2
7233,em quá đẹp anh yêu em,0
6150,quá đẹp hơn chán_vạn cô hoa_hậu ngày_nay,0
7176,hương_giang bạn thái lan đẹp nhất,0
1614,hốc lắm,1
4654,chắc mình tao thấy đẹp anh bên trái =,0
1556,sao eo bà nhỏ tí vậy trời,0
4982,tao sợ bây ơip,0
5097,đại minh_tinh rose,0
3877,nam_chính kén ăn hỉ ? toàn da bọc_xương ? grinning face with sweat thumbs up,1
142,tấm ảnh úp cũng thằng cameraman đang được tiêu_hoá,1
5947,vậy 31 / 10 tới không cần phải hoá_trang nữa bởi_vì chính gương_mặt tôi đã cá_mập tù_tội rùi đúng không quý_vị,0
4674,chúc bạn thành_công,0
1344,đẹp quá bác ơi smiling face with heart eyes,0
7350,phạm hương nhìn đẹp cô trag điểm tông nude mắt sống_mũi má hồng môi đều chỉnh chu rất kỹ nhin chung có nét đẹp tự_nhiên,0
787,dáng quá ok,0
2313,trung_thu rồi mới đăng_vậy cháu,0
210,thua cả jack thế,1
6788,vẫn còn full bộ ảnh chị chụp nude hồi trẻ thật_sự đẹp,0
4468,dạ quỳ liền,0
4350,ủa tự_nhiên tao há miệng,0
2417,phải kiêng ăn tập_thể_dục gầy đi mới đẹp được !,0
4459,quỳ,0
3473,chân cân_đối đẹp hơn tôi chân dài quá hơi tự ty 1m7 chân gần 1m05 so bình_quân chiều cao siêu_mẫu,0
1591,phong_cách vhy đỉnh rồi lối trang_điểm lần có vẻ làm cô xấu đi,0
923,nữ nhìn còn mê ê ê,0
2021,rất xinh nha,0
2666,ũngnguyễntuấn c5s em ý đã rời nextech từ 2019 bán hết cổ_phần 30 % cho nguyễn huy_hoàng em ý không liên_quan,0
3130,nói đi og cuối og đã chơi nhiu đá rồi,0
4548,miễn_cưỡng tim smirking face,0
5810,hót tren lè khe,1
6915,ôi !,0
6655,hà tăng rất đẹp phong_cách,0
3322,dẹo xương_sống không chị,0
1435,không xinh hát,0
450,ông nội mẹ ơi tướng vậy cũng thể_hình cơ_bắp tôi chịu grinning squinting face,0
5964,đầu_tư cho bản_thân sự tôn_trọng chính mình trông em thùy mị đẹp rất nhiều chúc_mừng em !,0
6577,cô thông_minh rat tài_năng cô vẻ đẹp châu á không hề chỉnh sữa ! bạn nói cô không đẹp vậy bạn được nhieu % cô !,0
5213,chị quen quen giống hoa_hậu nổi tiếg,0
904,anh_chị đáng yêu quá trời face with tears of joy clapping hands red heart,0
6098,qúa ý_chí bản_lĩnh vượt dèm pha đi người phụ nử tuyệt_vời u50 đẹp sang,0
3407,nụ cười hai người nghiện,0
475,đụ_mẹ bs người_ta nói đúng bản_thân như mày còn không biết thế_nào à,0
814,nhiều mỡ mỡ nó nằm đúng chỗ á smiling face with heart eyes,0
6698,ha_ha nhà mode cứ thiết_kế váy_áo thời_trang cho cô nàng mẫu gầy tong_teo đấy,0
4038,eo mê thée,0
2681,à tiến đẹp_trai quá red heart red heart,0
878,điện_thoại tui chụp ảnh em nó lưu_không được nặng quá,1
1727,500gb dung_lượng cũng phải lưu về lọ,0
2553,năn_nỉ chị thuận mới chịu ăn mì cay chắc_chắn có điều gì rất đặc_biệt món ăn ! đợi xem chị sẽ phản_ứng như thế_nào thử mì cay,0
605,quá keo lun chị ơi smiling face with hearts smiling face with hearts,0
2956,xấu chứ không phải ưa_nhìn nhé full moon face full moon face,2
5724,kaka họ chấm dựa tiêu_chí gì nhỉ y_như robot,1
6256,một câu_chuyện cảm_động mang tới góc nhìn khác về người_yêu cũ,0
3383,hồng tỷ đã xem đánh_giá,0
2465,chúc nhà nhân luôn thành_công mắn,0
6543,chỉ cần em thấy hạnh_phúc được,0
6684,giảm cân_bằng hoa_quả phải kiêng hoa_quả có đường chứ giảm cân cứ xoài sầu_riêng nho vẫn tăng cân vù vù ăn có loại quả nhạt có nhiều nước mới giảm cân được,0
3795,tâm_hồn to thế red heart,0
